{"scanViewConfigDescription":"Optimized for Tire Size with upside down support and instruction label.","cameraConfig":{"captureResolution":"1080"},"flashConfig":{"mode":"manual","alignment":"bottom_right"},"viewPluginConfig":{"pluginConfig":{"id":"Tire|Tire Size Specifications","tireSizeConfig":{"upsideDownMode":"AUTO"},"startScanDelay":1000,"cancelOnResult":true},"cutoutConfig":{"alignment":"center","maxWidthPercent":"60%","maxHeightPercent":"60%","ratioFromSize":{"width":25,"height":10},"strokeWidth":2,"strokeColor":"FFFFFF","cornerRadius":4,"outerColor":"000000","outerAlpha":0.5,"feedbackStrokeColor":"0099FF","offset":{"x":0,"y":-15}},"scanFeedbackConfig":{"animation":"traverse_multi","animationDuration":250,"style":"contour_rect","strokeWidth":2,"strokeColor":"0099FF","beepOnResult":false,"vibrateOnResult":true,"blinkAnimationOnResult":true},"uiFeedbackConfig":{"presets":[{"presetName":"simple_instruction_label","presetAttributes":[{"attributeName":"instruction_text","attributeValue":"Look for a standardized number sequence, like 205/55 R16"}]}]}}}
