{
  "scanViewConfigDescription": "Parallel scanning optimized for VIN and barcodes, returning the first successful scan, with instruction label.",
  "cameraConfig": {
    "captureResolution": "1080p",
    "pictureResolution": "1080p"
  },
  "flashConfig": {
    "mode": "manual",
    "alignment": "bottom_right"
  },
  "viewPluginCompositeConfig": {
    "id": "parallel-first-vin-barcode",
    "processingMode": "parallelFirstScan",
    "viewPlugins": [
      {
        "viewPluginConfig": {
          "pluginConfig": {
            "id": "barcode",
            "barcodeConfig": {
              "barcodeFormats": ["ALL"]
            }
          },
          "scanFeedbackConfig": {
            "style": "rect",
            "strokeWidth": 2,
            "strokeColor": "0099FF",
            "fillColor": "330099FF",
            "cornerRadius": 0,
            "beepOnResult": false,
            "vibrateOnResult": false,
            "blinkAnimationOnResult": true
          }
        }
      },
      {
        "viewPluginConfig": {
          "pluginConfig": {
            "id": "vin",
            "vinConfig": {}
          },
          "cutoutConfig": {
            "maxWidthPercent": "70%",
            "alignment": "top_half",
            "ratioFromSize": { "width": 689, "height": 100 },
            "offset": { "x": 0, "y": 0 },
            "outerColor": "000000",
            "outerAlpha": 0,
            "strokeWidth": 2,
            "strokeColor": "0099FF",
            "cornerRadius": 4,
            "feedbackStrokeColor": "0099FF"
          },
          "scanFeedbackConfig": {
            "style": "contour_rect",
            "animation": "traverse_multi",
            "animationDuration": 250,
            "strokeWidth": 2,
            "strokeColor": "0099FF",
            "fillColor": "220099FF",
            "beepOnResult": false,
            "vibrateOnResult": false,
            "blinkAnimationOnResult": true
          },
          "uiFeedbackConfig": {
            "presets": [
              {
                "presetName": "simple_instruction_label",
                "presetAttributes": [
                  {
                    "attributeName": "instruction_text",
                    "attributeValue": "Position the VIN within the cutout. The barcode can be anywhere inside the camera frame."
                  }
                ]
              }
            ]
          }
        }
      }
    ]
  }
}

