{
  "scanViewConfigDescription": "Optimized for vehicle identification numbers (VIN).",
  "cameraConfig": {
    "captureResolution": "1080p"
  },
  "flashConfig": {
    "mode": "manual",
    "alignment": "bottom_right"
  },
  "viewPluginConfig": {
    "pluginConfig": {
      "id": "vin",
      "vinConfig": {},
      "cancelOnResult": true
    },
    "cutoutConfig": {
      "alignment": "top_half",
      "maxWidthPercent": "70%",
      "maxHeightPercent": "70%",
      "ratioFromSize": {
        "width": 689,
        "height": 100
      },
      "strokeWidth": 1,
      "strokeColor": "FFFFFF",
      "cornerRadius": 2,
      "outerColor": "000000",
      "outerAlpha": 0.3,
      "feedbackStrokeColor": "0099FF"
    },
    "scanFeedbackConfig": {
      "animation": "traverse_multi",
      "animationDuration": 250,
      "style": "contour_rect",
      "strokeWidth": 2,
      "strokeColor": "0099FF",
      "beepOnResult": false,
      "vibrateOnResult": true,
      "blinkAnimationOnResult": true
    }
  }
}
