{
    "scanViewConfigDescription": "Optimized for dial meters.",
    "cameraConfig": {
        "captureResolution": "1080p",
        "pictureResolution": "1080p"
    },
    "flashConfig": {
        "mode": "manual",
        "alignment": "bottom_right"
    },
    "viewPluginConfig": {
        "pluginConfig": {
            "id": "meter_dial",
            "meterConfig": {
                "scanMode": "dial_meter"
            },
            "cancelOnResult": true
        },
        "cutoutConfig": {
            "maxWidthPercent": "85%",
            "alignment": "top",
            "ratioFromSize": {
                "width": 2,
                "height": 1
            },
            "offset": {
                "x": 0,
                "y": 160
            },
            "strokeWidth": 2,
            "cornerRadius": 4,
            "strokeColor": "0099FF",
            "outerColor": "000000",
            "outerAlpha": 0.3
        },
        "scanFeedbackConfig": {
            "style": "contour_rect",
            "strokeWidth": 2,
            "strokeColor": "0099FF",
            "fillColor": "220099FF",
            "cornerRadius": 2,
            "beepOnResult": true,
            "vibrateOnResult": true,
            "blinkAnimationOnResult": true,
            "redrawTimeout": 200,
            "animationDuration": 75
        }
    }
}