{
  "scanViewConfigDescription": "Optimized for EU license plates, with instruction label.",
  "cameraConfig": {
    "captureResolution": "1080p",
    "zoomGesture": true
  },
  "flashConfig": {
    "mode": "manual",
    "alignment": "bottom_right"
  },
  "viewPluginConfig": {
    "pluginConfig": {
      "id": "license_plate_eu",
      "licensePlateConfig": {
      },
      "cancelOnResult": true
    },
    "cutoutConfig": {
      "maxWidthPercent": "80%",
      "maxHeightPercent": "80%",
      "alignment": "top_half",
      "ratioFromSize": {
        "width": 2,
        "height": 1
      },
      "strokeWidth": 2,
      "cornerRadius": 10,
      "strokeColor": "FFFFFF",
      "outerColor": "000000",
      "outerAlpha": 0.3,
      "feedbackStrokeColor": "0099FF"
    },
    "scanFeedbackConfig": {
      "style": "rect",
      "strokeWidth": 2,
      "strokeColor": "0099FF",
      "fillColor": "330099FF",
      "cornerRadius": 0,
      "beepOnResult": true,
      "vibrateOnResult": true,
      "blinkAnimationOnResult": true
    },
    "uiFeedbackConfig": {
      "presets": [
        {
          "presetName": "simple_instruction_label",
          "presetAttributes": [
            {
              "attributeName": "instruction_text",
              "attributeValue": "Place the whole plate inside the cutout"
            }
          ]
        }
      ]
    }
  }
}
