{"scanViewConfigDescription":"Optimized for Commercial Tire with upside down support.","cameraConfig":{"captureResolution":"1080"},"flashConfig":{"mode":"manual","alignment":"bottom_right"},"viewPluginConfig":{"pluginConfig":{"id":"Tire|Commercial Tire ID","startScanDelay":1000,"cancelOnResult":true,"commercialTireIdConfig":{"upsideDownMode":"AUTO","minConfidence":0}},"cutoutConfig":{"alignment":"center","maxWidthPercent":"60%","maxHeightPercent":"60%","ratioFromSize":{"width":5,"height":1},"strokeWidth":2,"strokeColor":"FFFFFF","cornerRadius":4,"outerColor":"000000","outerAlpha":0.5,"feedbackStrokeColor":"0099FF","offset":{"x":0,"y":0}},"scanFeedbackConfig":{"animation":"traverse_multi","animationDuration":250,"style":"contour_rect","strokeWidth":2,"strokeColor":"0099FF","beepOnResult":false,"vibrateOnResult":true,"blinkAnimationOnResult":true}}}
