{
  "scanViewConfigDescription": "Optimized for DOT numbers with upside down support and UI feedback.",
  "cameraConfig": {
    "captureResolution": "1080"
  },
  "flashConfig": {
    "mode": "manual",
    "alignment": "bottom_right"
  },
  "viewPluginConfig": {
    "pluginConfig": {
      "id": "tin_dot",
      "tinConfig": {
        "scanMode": "DOT",
        "upsideDownMode": "AUTO"
      },
      "cancelOnResult": true
    },
    "cutoutConfig": {
      "alignment": "center",
      "maxWidthPercent": "60%",
      "maxHeightPercent": "60%",
      "ratioFromSize": {
        "width": 6.25,
        "height": 1
      },
      "strokeWidth": 2,
      "strokeColor": "FFFFFF",
      "cornerRadius": 4,
      "outerColor": "000000",
      "outerAlpha": 0.5,
      "feedbackStrokeColor": "0099FF",
      "offset": {
        "x": 0,
        "y": -15
      }
    },
    "scanFeedbackConfig": {
      "animation": "traverse_multi",
      "animationDuration": 250,
      "style": "contour_rect",
      "strokeWidth": 2,
      "strokeColor": "0099FF",
      "beepOnResult": false,
      "vibrateOnResult": true,
      "blinkAnimationOnResult": true
    },
    "uiFeedbackConfig": {
      "presets": [
        {
          "presetName": "tin_with_instruction_oriented_overlay_image_text_sound_feedback",
          "presetAttributes": [
            {
              "attributeName": "instruction_text",
              "attributeValue": "Please make sure the entire DOT number is inside the cutout."
            },
            {
              "attributeName": "cutout_overlay_normal_image",
              "attributeValue": "uifeedback_tin_dot_cutout_normal"
            },
            {
              "attributeName": "cutout_overlay_upsidedown_image",
              "attributeValue": "uifeedback_tin_dot_cutout_upsidedown"
            },
            {
              "attributeName": "alignment_alignleft_image",
              "attributeValue": "uifeedback_tin_dot_alignleft"
            },
            {
              "attributeName": "alignment_alignright_image",
              "attributeValue": "uifeedback_tin_dot_alignright"
            },
            {
              "attributeName": "lighting_toodark_image",
              "attributeValue": "uifeedback_default_toodark"
            },
            {
              "attributeName": "lighting_toobright_image",
              "attributeValue": "uifeedback_default_toobright"
            },
            {
              "attributeName": "distance_moveback_image",
              "attributeValue": "uifeedback_default_moveback"
            },
            {
              "attributeName": "distance_movecloser_image",
              "attributeValue": "uifeedback_default_movecloser"
            },
            {
              "attributeName": "format_wrong_image",
              "attributeValue": "uifeedback_tin_wrongformat"
            },
            {
              "attributeName": "date_wrong_image",
              "attributeValue": "uifeedback_tin_wrongformat"
            },
            {
              "attributeName": "alignment_alignleft_text",
              "attributeValue": ""
            },
            {
              "attributeName": "alignment_alignright_text",
              "attributeValue": ""
            },
            {
              "attributeName": "lighting_toodark_text",
              "attributeValue": ""
            },
            {
              "attributeName": "lighting_toobright_text",
              "attributeValue": ""
            },
            {
              "attributeName": "distance_moveback_text",
              "attributeValue": ""
            },
            {
              "attributeName": "distance_movecloser_text",
              "attributeValue": ""
            },
            {
              "attributeName": "format_wrong_text",
              "attributeValue": ""
            },
            {
              "attributeName": "date_wrong_text",
              "attributeValue": ""
            },
            {
              "attributeName": "alignment_alignleft_sound",
              "attributeValue": "info_sound_default.wav"
            },
            {
              "attributeName": "alignment_alignright_sound",
              "attributeValue": "info_sound_default.wav"
            },
            {
              "attributeName": "lighting_toodark_sound",
              "attributeValue": "info_sound_default.wav"
            },
            {
              "attributeName": "lighting_toobright_sound",
              "attributeValue": "info_sound_default.wav"
            },
            {
              "attributeName": "distance_moveback_sound",
              "attributeValue": "info_sound_default.wav"
            },
            {
              "attributeName": "distance_movecloser_sound",
              "attributeValue": "info_sound_default.wav"
            },
            {
              "attributeName": "format_wrong_sound",
              "attributeValue": "info_sound_default.wav"
            },
            {
              "attributeName": "date_wrong_sound",
              "attributeValue": "info_sound_default.wav"
            }
          ]
        }
      ]
    }
  }
}
