{
  "scanViewConfigDescription": "Optimized for analog and digital meters.",
  "cameraConfig": {
    "captureResolution": "1080p",
    "pictureResolution": "1080p"
  },
  "flashConfig": {
    "mode": "manual",
    "alignment": "bottom_right"
  },
  "viewPluginConfig": {
    "pluginConfig": {
      "id": "meter",
      "meterConfig": {
        "scanMode": "auto_analog_digital_meter"
      },
      "cancelOnResult": true
    },
    "cutoutConfig": {
      "alignment": "top",
      "strokeWidth": 2,
      "strokeColor": "FFFFFF",
      "cornerRadius": 4,
      "outerColor": "000000",
      "outerAlpha": 0.5,
      "feedbackStrokeColor": "0099FF",
      "maxWidthPercent": "85%",
      "maxHeightPercent": "85%",
      "ratioFromSize": {
        "width": 2,
        "height": 1
      },
      "offset": {
        "x": 0,
        "y": 120
      }
    },
    "scanFeedbackConfig": {
      "style": "contour_rect",
      "strokeColor": "0099FF",
      "strokeWidth": 2,
      "fillColor": "220099FF",
      "cornerRadius": 2,
      "redrawTimeout": 200,
      "animationDuration": 75,
      "blinkAnimationOnResult": true,
      "beepOnResult": true,
      "vibrateOnResult": true
    }
  }
}
