{
    "scanViewConfigDescription": "Parallel workflow optimized for scanning meters and serial numbers at the same time.",
    "cameraConfig": {
        "captureResolution": "1080p",
        "pictureResolution": "1080p"
    },
    "flashConfig": {
        "mode": "manual",
        "alignment": "bottom_right"
    },
    "viewPluginCompositeConfig": {
        "id": "parallel_meter_serial",
        "processingMode": "parallel",
        "viewPlugins": [
            {
                "viewPluginConfig": {
                    "pluginConfig": {
                        "id": "meter",
                        "meterConfig": {
                            "scanMode": "auto_analog_digital_meter"
                        },
                        "cancelOnResult": true,
                        "startScanDelay": 0
                    },
                    "cutoutConfig": {
                        "maxWidthPercent": "100%",
                        "width": 768,
                        "alignment": "top_half",
                        "ratioFromSize": {
                            "width": 9,
                            "height": 4
                        },
                        "strokeWidth": 2,
                        "cornerRadius": 4,
                        "strokeColor": "0099FF",
                        "outerColor": "000000",
                        "outerAlpha": 0.3
                    },
                    "scanFeedbackConfig": {
                        "style": "contour_rect",
                        "strokeWidth": 2,
                        "strokeColor": "0099FF",
                        "fillColor": "220099FF",
                        "cornerRadius": 2,
                        "beepOnResult": true,
                        "vibrateOnResult": true,
                        "blinkAnimationOnResult": true,
                        "redrawTimeout": 200,
                        "animationDuration": 75
                    },
                    "uiFeedbackConfig": {
                        "presets": [
                            {
                                "presetName": "simple_instruction_label",
                                "presetAttributes": [
                                    {
                                        "attributeName": "instruction_text",
                                        "attributeValue": "Meter"
                                    }
                                ]
                            }
                        ]
                    }
                }
            },
            {
                "viewPluginConfig": {
                    "pluginConfig": {
                        "id": "serial_number",
                        "ocrConfig": {
                            "scanMode": "auto"
                        },
                        "cancelOnResult": true
                    },
                    "cutoutConfig": {
                        "animation": "none",
                        "maxWidthPercent": "80%",
                        "alignment": "center",
                        "ratioFromSize": {
                            "width": 5,
                            "height": 1
                        },
                        "cornerRadius": 4,
                        "strokeColor": "0099ff",
                        "strokeWidth": 2,
                        "outerColor": "000000",
                        "feedbackStrokeColor": "0099FF",
                        "outerAlpha": 0.3
                    },
                    "scanFeedbackConfig": {
                        "style": "rect",
                        "strokeWidth": 2,
                        "cornerRadius": 2,
                        "strokeColor": "0099FF",
                        "fillColor": "330099FF",
                        "beepOnResult": true,
                        "vibrateOnResult": true,
                        "blinkAnimationOnResult": false
                    },
                    "uiFeedbackConfig": {
                        "presets": [
                            {
                                "presetName": "simple_instruction_label",
                                "presetAttributes": [
                                    {
                                        "attributeName": "instruction_text",
                                        "attributeValue": "Serial Number"
                                    }
                                ]
                            }
                        ]
                    }
                }
            }
        ]
    }
}