{
  "scanViewConfigDescription": "Optimized for scanning meter serial numbers.",
  "cameraConfig": {
    "captureResolution": "1080p"
  },
  "flashConfig": {
    "mode": "manual",
    "alignment": "bottom_right"
  },
  "viewPluginConfig": {
    "pluginConfig": {
      "id": "serial_number",
      "ocrConfig": {},
      "startScanDelay": 1000,
      "cancelOnResult": true
    },
    "cutoutConfig": {
      "alignment": "top_half",
      "maxWidthPercent": "80%",
      "maxHeightPercent": "80%",
      "ratioFromSize": {
        "width": 720,
        "height": 360
      },
      "strokeWidth": 2,
      "strokeColor": "FFFFFF",
      "cornerRadius": 4,
      "outerColor": "000000",
      "outerAlpha": 0.5,
      "feedbackStrokeColor": "0099FF",
      "offset": {
        "x": 0,
        "y": -15
      }
    },
    "scanFeedbackConfig": {
      "style": "contour_rect",
      "strokeColor": "0099FF",
      "fillColor": "220099FF",
      "beepOnResult": true,
      "vibrateOnResult": true,
      "blinkAnimationOnResult": true
    }
  }
}
