{
  "scanViewConfigDescription": "Optimized for Tire Make with upside down support.",
  "cameraConfig": {
    "captureResolution": "1080"
  },
  "flashConfig": {
    "mode": "manual",
    "alignment": "bottom_right"
  },
  "viewPluginConfig": {
    "pluginConfig": {
      "id": "Tire|Tire Make",
      "tireMakeConfig": {
        "upsideDownMode": "AUTO"
      },
      "cancelOnResult": true
    },
    "cutoutConfig": {
      "alignment": "center",
      "maxWidthPercent": "60%",
      "maxHeightPercent": "60%",
      "ratioFromSize": {
        "width": 5,
        "height": 1
      },
      "strokeWidth": 2,
      "strokeColor": "FFFFFF",
      "cornerRadius": 4,
      "outerColor": "000000",
      "outerAlpha": 0.5,
      "feedbackStrokeColor": "0099FF",
      "offset": {
        "x": 0,
        "y": -15
      }
    },
    "scanFeedbackConfig": {
      "animation": "traverse_multi",
      "animationDuration": 250,
      "style": "contour_rect",
      "strokeWidth": 2,
      "strokeColor": "0099FF",
      "beepOnResult": false,
      "vibrateOnResult": true,
      "blinkAnimationOnResult": true
    }
  }
}
