{
  "scanViewConfigDescription": "Optimized for scanning vertical containers.",
  "cameraConfig": {
    "captureResolution": "1080p"
  },
  "flashConfig": {
    "mode": "manual",
    "alignment": "bottom_right"
  },
  "viewPluginConfig": {
    "pluginConfig": {
      "id": "container_vertical",
      "containerConfig": {
        "scanMode": "VERTICAL"
      },
      "cancelOnResult": true
    },
    "cutoutConfig": {
      "maxWidthPercent": "10%",
      "alignment": "center",
      "ratioFromSize": {
        "width": 0.15,
        "height": 1.00
      },
      "strokeWidth": 2,
      "strokeColor": "FFFFFF",
      "cornerRadius": 4,
      "outerColor": "000000",
      "outerAlpha": 0.5,
      "feedbackStrokeColor": "0099FF",
      "offset": {
        "x": 0,
        "y": -15
      },
      "cropOffset": {
        "x": 0,
        "y": -15
      }
    },
    "scanFeedbackConfig": {
      "style": "contour_rect",
      "strokeColor": "0099FF",
      "fillColor": "220099FF",
      "blinkAnimationOnResult": true,
      "beepOnResult": true,
      "vibrateOnResult": true
    }
  }
}
